<?xml version="1.0" encoding="utf-8" ?>
				<!-- Last Updated: Fri, 01 Feb 2013 17:22:48 -0500 -->
				<projects xmlns:xsi="http://www.w3.org/2000/10/XMLSchema-instance" xsi:noNamespaceSchemaLocation="projects.xsd">
				<project id="projectID501aff0a23c47">
				<nameofwork>The Beckoning Hand: The Search Party&#039;s Find</nameofwork>
				<authorsname>Allen, Grant</authorsname>
				<language>English</language>
				<posteddate>Thu, 31 Jan 2013 21:25:03 -0500</posteddate>
				<genre>Short Story</genre>
				<links>
				<PG_catalog>http://www.fadedpage.com/books/</PG_catalog>
				<library>http://www.pgdpcanada.net/c/list_etexts.php?x=g&amp;sort=5#projectID501aff0a23c47</library>
				</links>
				</project>
				<project id="projectID4fbecbff7bf0c">
				<nameofwork>Fun-jottings; or, Laughs I have taken a pen to (1854)</nameofwork>
				<authorsname>Willis, N.P. (Nathaniel Parker) 1806-1867</authorsname>
				<language>English</language>
				<posteddate>Wed, 30 Jan 2013 06:45:53 -0500</posteddate>
				<genre>Humor</genre>
				<links>
				<PG_catalog>http://www.fadedpage.com/books/</PG_catalog>
				<library>http://www.pgdpcanada.net/c/list_etexts.php?x=g&amp;sort=5#projectID4fbecbff7bf0c</library>
				</links>
				</project>
				<project id="projectID50f4c0b93dfc7">
				<nameofwork>La bibliothèque canadienne, Tome 3, Nº 03 Aout 1826</nameofwork>
				<authorsname>Various</authorsname>
				<language>French</language>
				<posteddate>Wed, 30 Jan 2013 06:44:08 -0500</posteddate>
				<genre>Literature</genre>
				<links>
				<PG_catalog>http://www.fadedpage.com/books/</PG_catalog>
				<library>http://www.pgdpcanada.net/c/list_etexts.php?x=g&amp;sort=5#projectID50f4c0b93dfc7</library>
				</links>
				</project>
				<project id="projectID50f2e927a7ad3">
				<nameofwork>The Canadian Horticulturist Volume 08, No. 06</nameofwork>
				<authorsname>The Fruit Growers Association of Ontario</authorsname>
				<language>English</language>
				<posteddate>Wed, 30 Jan 2013 06:43:26 -0500</posteddate>
				<genre>Horticulture</genre>
				<links>
				<PG_catalog>http://www.fadedpage.com/books/</PG_catalog>
				<library>http://www.pgdpcanada.net/c/list_etexts.php?x=g&amp;sort=5#projectID50f2e927a7ad3</library>
				</links>
				</project>
				<project id="projectID50fc7858f0b5e">
				<nameofwork>Geschichte der Deutschen Zeichnung und Graphik (1951)</nameofwork>
				<authorsname>Fischer, Otto (1886-1948)</authorsname>
				<language>German</language>
				<posteddate>Sun, 27 Jan 2013 21:12:32 -0500</posteddate>
				<genre>Art</genre>
				<links>
				<PG_catalog>http://www.fadedpage.com/books/</PG_catalog>
				<library>http://www.pgdpcanada.net/c/list_etexts.php?x=g&amp;sort=5#projectID50fc7858f0b5e</library>
				</links>
				</project>
				<project id="projectID510201ded601d">
				<nameofwork>Harper of Heaven (1948)</nameofwork>
				<authorsname>Service, Robert William (1874-1958)</authorsname>
				<language>English</language>
				<posteddate>Sat, 26 Jan 2013 23:08:51 -0500</posteddate>
				<genre>Autobiography</genre>
				<links>
				<PG_catalog>http://www.fadedpage.com/books/</PG_catalog>
				<library>http://www.pgdpcanada.net/c/list_etexts.php?x=g&amp;sort=5#projectID510201ded601d</library>
				</links>
				</project>
				<project id="projectID510192656c30a">
				<nameofwork>Face Cards (1925)</nameofwork>
				<authorsname>Carolyn Wells (1862-1942)</authorsname>
				<language>English</language>
				<posteddate>Sat, 26 Jan 2013 23:07:59 -0500</posteddate>
				<genre>Poetry</genre>
				<links>
				<PG_catalog>http://www.fadedpage.com/books/</PG_catalog>
				<library>http://www.pgdpcanada.net/c/list_etexts.php?x=g&amp;sort=5#projectID510192656c30a</library>
				</links>
				</project>
				<project id="projectID510130c1ac66a">
				<nameofwork>Out of Africa (1937)</nameofwork>
				<authorsname>Karen Blixen (1885-1962)</authorsname>
				<language>English</language>
				<posteddate>Sat, 26 Jan 2013 23:07:33 -0500</posteddate>
				<genre>Non-Fiction</genre>
				<links>
				<PG_catalog>http://www.fadedpage.com/books/</PG_catalog>
				<library>http://www.pgdpcanada.net/c/list_etexts.php?x=g&amp;sort=5#projectID510130c1ac66a</library>
				</links>
				</project>
				<project id="projectID5095399baf862">
				<nameofwork>Hester vol. 3 (1883)</nameofwork>
				<authorsname>Oliphant, Margaret (1828-1897)</authorsname>
				<language>English</language>
				<posteddate>Thu, 24 Jan 2013 18:57:11 -0500</posteddate>
				<genre>General Fiction</genre>
				<links>
				<PG_catalog>http://www.fadedpage.com/books/</PG_catalog>
				<library>http://www.pgdpcanada.net/c/list_etexts.php?x=g&amp;sort=5#projectID5095399baf862</library>
				</links>
				</project>
				<project id="projectID50fddfb20fd2d">
				<nameofwork>First Furrows (1923)</nameofwork>
				<authorsname>Alfred Campbell Garrioch (1848-1934)</authorsname>
				<language>English</language>
				<posteddate>Wed, 23 Jan 2013 19:02:18 -0500</posteddate>
				<genre>History</genre>
				<links>
				<PG_catalog>http://www.fadedpage.com/books/</PG_catalog>
				<library>http://www.pgdpcanada.net/c/list_etexts.php?x=g&amp;sort=5#projectID50fddfb20fd2d</library>
				</links>
				</project>
				
				</projects>