<?xml version="1.0" encoding="utf-8" ?>
				<!-- Last Updated: Fri, 01 Feb 2013 19:49:00 -0500 -->
				<projects xmlns:xsi="http://www.w3.org/2000/10/XMLSchema-instance" xsi:noNamespaceSchemaLocation="projects.xsd">
				<project id="projectID4f80a56494915">
				<nameofwork>Christmas Holidays, or, a new way of spending them (1863)</nameofwork>
				<authorsname>Strickland, Jane Margaret 1800-1888</authorsname>
				<language>English</language>
				<posteddate>Fri, 01 Feb 2013 07:15:00 -0500</posteddate>
				<genre>Instructional</genre>
				<links>
				<PG_catalog>http://www.fadedpage.com/books/</PG_catalog>
				<library>http://www.pgdpcanada.net/c/list_etexts.php?x=g&amp;sort=5#projectID4f80a56494915</library>
				</links>
				</project>
				<project id="projectID4f96abd9ddb1a">
				<nameofwork>Manual of the Wood-craft Indians, fourteenth Birch-bark Roll (1915)</nameofwork>
				<authorsname>Seton, Ernest Thompson (1860-1946)</authorsname>
				<language>English</language>
				<posteddate>Fri, 01 Feb 2013 07:14:43 -0500</posteddate>
				<genre>Spirituality</genre>
				<links>
				<PG_catalog>http://www.fadedpage.com/books/</PG_catalog>
				<library>http://www.pgdpcanada.net/c/list_etexts.php?x=g&amp;sort=5#projectID4f96abd9ddb1a</library>
				</links>
				</project>
				<project id="projectID50f3082558bd8">
				<nameofwork>On Grandfather&#039;s Farm</nameofwork>
				<authorsname>Fréchette, Annie Thomas, 1844-1938 (neé Howells)</authorsname>
				<language>English</language>
				<posteddate>Fri, 01 Feb 2013 07:14:26 -0500</posteddate>
				<genre>Juvenile</genre>
				<links>
				<PG_catalog>http://www.fadedpage.com/books/</PG_catalog>
				<library>http://www.pgdpcanada.net/c/list_etexts.php?x=g&amp;sort=5#projectID50f3082558bd8</library>
				</links>
				</project>
				<project id="projectID4e4863607a745">
				<nameofwork>Our Young Folks 1867-10 Volume 3, Issue 10</nameofwork>
				<authorsname>J. T. Trowbridge, Gail Hamilton, and Lucy Larcom (Editors)</authorsname>
				<language>English</language>
				<posteddate>Fri, 01 Feb 2013 07:13:46 -0500</posteddate>
				<genre>Periodical</genre>
				<links>
				<PG_catalog>http://www.fadedpage.com/books/</PG_catalog>
				<library>http://www.pgdpcanada.net/c/list_etexts.php?x=g&amp;sort=5#projectID4e4863607a745</library>
				</links>
				</project>
				<project id="projectID4fa4ae460e620">
				<nameofwork>The Montreal Medical Gazette, Volume 1, Issue 11 February 1845</nameofwork>
				<authorsname>William Sutherland (1815-1875),  Francis Badgley (1807-1863) (Editors)</authorsname>
				<language>English with French</language>
				<posteddate>Fri, 01 Feb 2013 07:10:55 -0500</posteddate>
				<genre>Medicine</genre>
				<links>
				<PG_catalog>http://www.fadedpage.com/books/</PG_catalog>
				<library>http://www.pgdpcanada.net/c/list_etexts.php?x=g&amp;sort=5#projectID4fa4ae460e620</library>
				</links>
				</project>
				<project id="projectID4b01f3647137e">
				<nameofwork>How to Parse:</nameofwork>
				<authorsname>Edwin A. Abbott, D.D. (1838-1926)</authorsname>
				<language>English</language>
				<posteddate>Fri, 01 Feb 2013 04:29:59 -0500</posteddate>
				<genre>Literature</genre>
				<links>
				<PG_catalog>http://www.fadedpage.com/books/</PG_catalog>
				<library>http://www.pgdpcanada.net/c/list_etexts.php?x=g&amp;sort=5#projectID4b01f3647137e</library>
				</links>
				</project>
				<project id="projectID4f7f35d46b81b">
				<nameofwork>The Treatment of Drapery in Art (1904)</nameofwork>
				<authorsname>Woolliscroft-Rhead, George (1855-1920)</authorsname>
				<language>English</language>
				<posteddate>Fri, 01 Feb 2013 03:33:54 -0500</posteddate>
				<genre>Art</genre>
				<links>
				<PG_catalog>http://www.fadedpage.com/books/</PG_catalog>
				<library>http://www.pgdpcanada.net/c/list_etexts.php?x=g&amp;sort=5#projectID4f7f35d46b81b</library>
				</links>
				</project>
				<project id="projectID4ebd2ad515248">
				<nameofwork>A Widow&#039;s Tale and other stories</nameofwork>
				<authorsname>Oliphant, Margaret , (1828-1897)</authorsname>
				<language>English</language>
				<posteddate>Fri, 01 Feb 2013 03:33:01 -0500</posteddate>
				<genre>Short Story</genre>
				<links>
				<PG_catalog>http://www.fadedpage.com/books/</PG_catalog>
				<library>http://www.pgdpcanada.net/c/list_etexts.php?x=g&amp;sort=5#projectID4ebd2ad515248</library>
				</links>
				</project>
				<project id="projectID4e3aa79b7c4b9">
				<nameofwork>Correspondence of Madame, Princess Palatine, etc. (1899)</nameofwork>
				<authorsname>Wormeley, Katharine Prescott (tr.)</authorsname>
				<language>English</language>
				<posteddate>Fri, 01 Feb 2013 03:32:10 -0500</posteddate>
				<genre>Correspondence</genre>
				<links>
				<PG_catalog>http://www.fadedpage.com/books/</PG_catalog>
				<library>http://www.pgdpcanada.net/c/list_etexts.php?x=g&amp;sort=5#projectID4e3aa79b7c4b9</library>
				</links>
				</project>
				<project id="projectID4ef86bfc9215e">
				<nameofwork>Nelson&#039;s History of the War vol. 2 (1914)</nameofwork>
				<authorsname>Buchan, John (1875-1940)</authorsname>
				<language>English</language>
				<posteddate>Fri, 01 Feb 2013 03:31:21 -0500</posteddate>
				<genre>History</genre>
				<links>
				<PG_catalog>http://www.fadedpage.com/books/</PG_catalog>
				<library>http://www.pgdpcanada.net/c/list_etexts.php?x=g&amp;sort=5#projectID4ef86bfc9215e</library>
				</links>
				</project>
				
				</projects>