<?xml version="1.0" encoding="utf-8" ?>
				<!-- Last Updated: Fri, 01 Feb 2013 19:49:00 -0500 -->
				<projects xmlns:xsi="http://www.w3.org/2000/10/XMLSchema-instance" xsi:noNamespaceSchemaLocation="projects.xsd">
				<project id="projectID4d0176bb1f64c">
				<nameofwork>The Inevitable Millionaires (1919)</nameofwork>
				<authorsname>E. Phillips Oppenheim (1866-1946)</authorsname>
				<language>English</language>
				<posteddate>Thu, 31 Jan 2013 16:59:37 -0500</posteddate>
				<genre>Mystery</genre>
				<links>
				<PG_catalog>http://www.fadedpage.com/books/20130142</PG_catalog>
				<library>http://www.pgdpcanada.net/c/list_etexts.php?x=g&amp;sort=5#projectID4d0176bb1f64c</library>
				</links>
				</project>
				<project id="projectID4b8fac85417ee">
				<nameofwork>Old Sultan; Grimm&#039;s Fairy Tales</nameofwork>
				<authorsname>Brothers Grimm</authorsname>
				<language>English</language>
				<posteddate>Thu, 31 Jan 2013 15:49:44 -0500</posteddate>
				<genre>Juvenile</genre>
				<links>
				<PG_catalog>http://www.fadedpage.com/books/20130141</PG_catalog>
				<library>http://www.pgdpcanada.net/c/list_etexts.php?x=g&amp;sort=5#projectID4b8fac85417ee</library>
				</links>
				</project>
				<project id="projectID504e554fc40f6">
				<nameofwork>The Cradle Ship (1916, 1941)</nameofwork>
				<authorsname>Howes, Edith (1872-1954); Florence Mary Anderson (1874 – 1930) illustrator</authorsname>
				<language>English</language>
				<posteddate>Thu, 31 Jan 2013 12:46:15 -0500</posteddate>
				<genre>Folklore</genre>
				<links>
				<PG_catalog>http://www.fadedpage.com/books/20130140</PG_catalog>
				<library>http://www.pgdpcanada.net/c/list_etexts.php?x=g&amp;sort=5#projectID504e554fc40f6</library>
				</links>
				</project>
				<project id="projectID4bfeda5937efd">
				<nameofwork>The House of the Four Winds</nameofwork>
				<authorsname>Buchan, John ( 1875-1940)</authorsname>
				<language>English</language>
				<posteddate>Wed, 30 Jan 2013 21:24:55 -0500</posteddate>
				<genre>Adventure</genre>
				<links>
				<PG_catalog>http://www.fadedpage.com/books/20130139</PG_catalog>
				<library>http://www.pgdpcanada.net/c/list_etexts.php?x=g&amp;sort=5#projectID4bfeda5937efd</library>
				</links>
				</project>
				<project id="projectID4b7b07fbe63da">
				<nameofwork>Mrs Fox; Grimm&#039;s Fairy Tales</nameofwork>
				<authorsname>Brothers Grimm</authorsname>
				<language>English</language>
				<posteddate>Wed, 30 Jan 2013 17:35:37 -0500</posteddate>
				<genre>Juvenile</genre>
				<links>
				<PG_catalog>http://www.fadedpage.com/books/20130138</PG_catalog>
				<library>http://www.pgdpcanada.net/c/list_etexts.php?x=g&amp;sort=5#projectID4b7b07fbe63da</library>
				</links>
				</project>
				<project id="projectID4b7af02392c27">
				<nameofwork>Jorinda and Jorindel; Grimm&#039;s Fairy Tales</nameofwork>
				<authorsname>Brothers Grimm</authorsname>
				<language>English</language>
				<posteddate>Wed, 30 Jan 2013 15:48:59 -0500</posteddate>
				<genre>Juvenile</genre>
				<links>
				<PG_catalog>http://www.fadedpage.com/books/20130137</PG_catalog>
				<library>http://www.pgdpcanada.net/c/list_etexts.php?x=g&amp;sort=5#projectID4b7af02392c27</library>
				</links>
				</project>
				<project id="projectID486edc27c7725">
				<nameofwork>The Canadian Album Volume 1</nameofwork>
				<authorsname>Rev. William Cochrane (Editor)</authorsname>
				<language>English</language>
				<posteddate>Tue, 29 Jan 2013 01:10:10 -0500</posteddate>
				<genre>Biography</genre>
				<links>
				<PG_catalog>http://www.fadedpage.com/books/20130136</PG_catalog>
				<library>http://www.pgdpcanada.net/c/list_etexts.php?x=g&amp;sort=5#projectID486edc27c7725</library>
				</links>
				</project>
				<project id="projectID4b1e5e70283ca">
				<nameofwork>La lucha por la vida: Aurora Roja</nameofwork>
				<authorsname>Pío Baroja</authorsname>
				<language>Spanish</language>
				<posteddate>Mon, 28 Jan 2013 17:09:55 -0500</posteddate>
				<genre>General Fiction</genre>
				<links>
				<PG_catalog>http://www.fadedpage.com/books/20130134</PG_catalog>
				<library>http://www.pgdpcanada.net/c/list_etexts.php?x=g&amp;sort=5#projectID4b1e5e70283ca</library>
				</links>
				</project>
				<project id="projectID4fb255c2b910b">
				<nameofwork>The Christian Recorder Vol. 1, Issue 7 (1819-September)</nameofwork>
				<authorsname>Various</authorsname>
				<language>English</language>
				<posteddate>Mon, 28 Jan 2013 16:42:14 -0500</posteddate>
				<genre>Religious</genre>
				<links>
				<PG_catalog>http://www.fadedpage.com/books/20130135</PG_catalog>
				<library>http://www.pgdpcanada.net/c/list_etexts.php?x=g&amp;sort=5#projectID4fb255c2b910b</library>
				</links>
				</project>
				<project id="projectID4fb2ff23b6176">
				<nameofwork>The Christian Recorder Vol. 1, Issue 10 (1819-December)</nameofwork>
				<authorsname>Various</authorsname>
				<language>English</language>
				<posteddate>Sun, 27 Jan 2013 17:33:54 -0500</posteddate>
				<genre>Religious</genre>
				<links>
				<PG_catalog>http://www.fadedpage.com/books/20130132</PG_catalog>
				<library>http://www.pgdpcanada.net/c/list_etexts.php?x=g&amp;sort=5#projectID4fb2ff23b6176</library>
				</links>
				</project>
				
				</projects>